{
  "id": "lucozade-energy",
  "slug": "lucozade-energy",
  "name": "Lucozade Energy (Original)",
  "brandId": "lucozade",
  "categoryId": "soft-drinks",
  "manufacturer": {
    "value": "Suntory Beverage and Food GB and Ireland (Lucozade Ribena Suntory until 2020)",
    "sources": ["sbf-gbi-2020"],
    "confidence": "high",
    "evidence": "moderate",
    "updated": "2026-06-30",
    "claimType": "authoritative",
    "note": "The maker was renamed from Lucozade Ribena Suntory to Suntory Beverage and Food GB and Ireland in September 2020; Open Food Facts still records the legacy name."
  },
  "ingredientsText": {
    "value": "Carbonated Water, Glucose Syrup (13%), Acids (Citric Acid, Lactic Acid), Flavourings, Acidity Regulator (Sodium Citrate), Preservative (Potassium Sorbate), Caffeine, Sweeteners (Sucralose, Acesulfame K), Antioxidant (Ascorbic Acid), Colours (Sunset Yellow, Ponceau 4R), Niacin (B3)",
    "sources": ["off"],
    "confidence": "low",
    "evidence": "low",
    "updated": "2026-06-30",
    "claimType": "authoritative",
    "claimDomain": "ingredient-function",
    "note": "Transcribed from a single Open Food Facts record (tertiary, a low-quality crowd transcription). Open Food Facts records the sweeteners as sucralose with acesulfame K, but a GB retailer label sheet lists aspartame with acesulfame K instead, and the wider list differs in other respects. The sweetener identity is an unresolved discrepancy pending a primary label; a direct manufacturer or retailer label page could not be retrieved (Tesco returned HTTP 403)."
  },
  "nutrition": {
    "sugars": {
      "value": 4.16,
      "sources": ["off"],
      "confidence": "moderate",
      "evidence": "low",
      "updated": "2026-06-30",
      "claimType": "authoritative",
      "claimDomain": "nutrition",
      "note": "Open Food Facts records 4.16g sugars per 100g; the marketed GB label figure is 4.5g per 100ml (a small per-100g versus per-100ml unit difference, not a contradiction)."
    }
  },
  "verificationStatus": null,
  "publicationStatus": null
}
