{
  "id": "cadbury-dairy-milk",
  "slug": "cadbury-dairy-milk",
  "name": "Cadbury Dairy Milk",
  "brandId": "cadbury",
  "categoryId": "chocolate",
  "manufacturer": {
    "value": "Mondelez International (Cadbury)",
    "sources": ["off"],
    "confidence": "high",
    "evidence": "moderate",
    "updated": "2026-06-30",
    "claimType": "authoritative",
    "note": "Cadbury has been owned by Mondelez International since the 2010 Kraft takeover."
  },
  "ingredientsText": {
    "value": "Milk, Sugar, Cocoa Butter, Cocoa Mass, Vegetable Fats (Palm, Shea), Emulsifiers (E442, E476), Flavourings",
    "sources": ["cadbury-uk-2026"],
    "confidence": "high",
    "evidence": "moderate",
    "updated": "2026-06-30",
    "claimType": "authoritative",
    "claimDomain": "ingredient-function",
    "note": "Current GB label from the manufacturer's own product page. An earlier Open Food Facts transcription carried a longer, soya-lecithin-bearing list (with dried whey and milk fat); that appears to be a non-GB or stale formulation and was set aside in favour of the manufacturer page. GB Dairy Milk uses emulsifiers E442 and E476 rather than soya lecithin. Vegetable fats (palm, shea) are permitted up to 5% under GB chocolate rules."
  },
  "nutrition": {
    "sugars": {
      "value": 57,
      "sources": ["off"],
      "confidence": "moderate",
      "evidence": "low",
      "updated": "2026-06-30",
      "claimType": "authoritative",
      "claimDomain": "nutrition",
      "note": "About 56 to 57g per 100g, stable across 2019 to 2026. The FSA-linked sugar reduction produced a separate lower-sugar variant (see the timeline event), not a reduction of the standard bar."
    }
  },
  "allergens": [
    {
      "allergen": "milk",
      "presence": "present",
      "provenance": {
        "value": "Declared on the current GB label",
        "sources": ["cadbury-uk-2026"],
        "confidence": "high",
        "evidence": "moderate",
        "updated": "2026-06-30",
        "claimType": "authoritative",
        "claimDomain": "allergen"
      }
    },
    {
      "allergen": "tree-nuts",
      "presence": "may-contain",
      "provenance": {
        "value": "Carries a may-contain-nuts precautionary statement on the current GB label",
        "sources": ["cadbury-uk-2026"],
        "confidence": "high",
        "evidence": "moderate",
        "updated": "2026-06-30",
        "claimType": "authoritative",
        "claimDomain": "allergen"
      }
    },
    {
      "allergen": "cereals-containing-gluten",
      "presence": "may-contain",
      "provenance": {
        "value": "Carries a may-contain-wheat precautionary statement on the current GB label",
        "sources": ["cadbury-uk-2026"],
        "confidence": "high",
        "evidence": "moderate",
        "updated": "2026-06-30",
        "claimType": "authoritative",
        "claimDomain": "allergen"
      }
    }
  ],
  "verificationStatus": null,
  "publicationStatus": null
}
